{
  "command": "/ux-audit",
  "status": "pass",
  "scope": "<scope>",
  "goal": "<goal>",
  "summary": {
    "findingCount": 0,
    "bySeverity": {
      "critical": 0,
      "high": 0,
      "medium": 0,
      "low": 0,
      "info": 0
    },
    "releaseBlockers": 0
  },
  "findings": [],
  "groupedFindings": [],
  "prioritizedRemediation": [],
  "validation": []
}
